{
  "author": { "name": "Snow Mint", "url": "https://github.com/snw-mint" },
  "capabilities": ["styles"],
  "compatibility": {
    "bridgeApi": ">=1.0.0 <2.0.0",
    "packSchema": ">=1 <2",
    "runtimeApi": ">=1.0.0 <2.0.0"
  },
  "entry": { "style": "theme/lyra.css", "themeId": "modern-player" },
  "family": "better-lyrics",
  "id": "io.github.snw-mint.better-lyrics-modern-player",
  "kind": "theme",
  "license": { "notice": "NOTICE", "spdx": "MIT" },
  "name": "ModernPlayer",
  "schemaVersion": 1,
  "version": "1.0.1"
}
